id;title;author;author_id;publisher;publisher_id;date;pubPlace;pubPlace_id;pages;stamp
Moreau672_GBOOKS;La censure et l'antidote de quelques maximes tres-pernicieuses, contenuës dans un libelle qui a pour titre, Le recit du duel déplorable entre messieurs les ducs de Beaufort, & de Nemours. Addressé à la noblesse raisonnable & chrestienne.;;;;;1652;Paris;geonames:2988507;12;True
Moreau615_GBOOKS;Busire (le) étranger, démonté par les Alcides de France, sur la résolution généreuse de messieurs les princes pour la ruine du parti Mazarin, où se voient les justes causes du refus de plusieurs villes, fait à ce cardinal, de le recevoir.;;;;;1652;Paris;geonames:2988507;15;False
Moreau620_GBOOKS;Camouflet (le) donné à la ville de Paris pour la réveiller de sa léthargie.;;;;;1652;Paris;geonames:2988507;16;True
Moreau631_GALL;"Caractère (le) de la royauté et de la tyrannie, faisant voir par un discours politique : 1° Les qualités nécessaires à un prince pour bien gouverner ses sujets ; 2° Les maux qui arrivent aux peuples lorsque les souverains sont incapables de les gouverner.";;;;;1652;Paris;geonames:2988507;24;True
Moreau604_GALL;Bouteille (la) cassée, attachée avec une fronde au cul de Mazarin, fuyant après avoir su la grande défaite de son armée par celle de Son Altesse Royale, commandée par monseigneur le prince de Condé.;;;;;1652;Paris;geonames:2988507;15;False
Moreau616_MAZ;Cacus (le) Italien renversé par l’Hercule François, en prose et en vers burlesques, par le sieur D. L. G.;;;;;1652;Paris;geonames:2988507;8;True
Moreau4008_GALL;Vérités (les) de l'hermite de l'île d'Oleron, présentées au roi à Poitiers.;;;;;1652;Paris;geonames:2988507;15;True
Moreau4058_GBOOKS;Voix (la) du peuple au roi pour la paix générale.;;;;;1652;Paris;geonames:2988507;44;True
Moreau4052_GBOOKS;Voies (les) de la paix.;;;;;1652;Paris;geonames:2988507;24;False
Moreau4074_GBOOKS;Vraie (la) et véritable harangue faite au roi par un des principaux députés, en présence de toute sa cour, assurant Sa Majesté de leur obéissance et fidélité à la couronne, et le suppliant de revenir en sa bonne ville de Paris pour y résoudre et faire la paix générale.;;;Valentin, Claude;;1652;Paris;geonames:2988507;6;True
Moreau4060_GBOOKS;Voix (la) du peuple, servant d'avertissement à monsieur le Prince dans la conjoncture des affaires du temps.;;;;;1652;Paris;geonames:2988507;19;True
Moreau1122_GBOOKS;Discours faisant voir tout ce qui s’est passé devant et après la retraite du C. Mazarin, tant à Compiègne qu'aux armées de messieurs les princes, en forme d'entretien entre un cavalier frondeur et un cavalier mazarin, sur le chemin de Compiègne à Paris, où se voit l'histoire de sa mauvaise conduite jusques à présent.;;;;;1652;Paris;geonames:2988507;19;False
Moreau1939_GBOOKS;Lettre de la France en l'agonie, présentée à Sa Majesté par messieurs de la ville de Rouen dans Pontoise pour la paix générale.;;;Beauplet, David;;1652;Paris;geonames:2988507;7;False
Moreau1562_GBOOKS;Harangue en proverbes, faite à la reine par un notable bourgeois de la ville de Pontoise, deux jours avant le départ de Mazarin, pour obliger cette princesse à consentir à son éloignement par les raisons cy-après déduites.;;;;;1652;Paris;geonames:2988507;32;True
Moreau1530_GBOOKS;Guerre (la) mourante par la nécessité de faire la paix, prouvées (sic) par les meilleures maximes du gouvernement des États.;;;;;1652;Paris;geonames:2988507;19;False
Moreau1592_GBOOKS;Harangue faite au roi par les six corps de marchands de la ville de Paris, avec l'entretien d'un marchand épicier et d'un marchand mercier, à leur retour de Pontoise.;;;;;1652;Paris;geonames:2988507;16;False
Moreau1251_GBOOKS;Entretiens (les) de saint Maigrin (sic) et de Mancini aux champs élysiens (sic), et l’arrivée du duc de Nemours au même lieu, avec la description de l’appartement qu’on prépare à Mazarin dans les enfers.;;;;;1652;Paris;geonames:2988507;32;True
Moreau1287_GBOOKS;Esprit (l') du feu roi Louis le Juste à la reine, lui témoignant ses sensiblés regrets sur le mauvais gouvernement de l’État.;;;;;1652;Paris;geonames:2988507;31;True
Moreau2984_MAZ;Récit d'un combat donné entre monsieur le prince de Condé et le comte d'Harcourt, avec les noms des morts et des prisonniers, ensemble la prise des châteaux d'Ambleville et de Barbésieux en Angoumois.;;;;;1652;Paris;geonames:2988507;8;False
Moreau2909_GBOOKS;Prophétie curieuse et remarquable d'un certain Rouallond, natif d'un village appelé la Rouallondière, dans la paroisse de Chollet, près le pays de Retz, dans l'évêché de Maillezais, en l'an 1480, sur les affaires de la France.;;;;;1652;Paris;geonames:2988507;8;True
Moreau2908_GBOOKS;Prophète (le) véritable de messieurs de Paris, envoyée (sic) à la reine sur leurs dernières résolutions.;;;;;1652;Paris;geonames:2988507;6;True
Moreau3096_GBOOKS;Relation contenant ce qui s'est passé samedi , dernier jour du mois (août), au faubourg Saint-Marcel entre la garde bourgeoise et les gens de guerre des princes.;;;;;1652;Paris;geonames:2988507;8;True
Moreau3098_GALL;Relation contenant le secours jette dans la ville de Gravelines par les soins du sieur d'Estrades, lieutenant général dans les armées du roi et gouverneur de Dunkerque, avec l'état de cette première place et ce qui s'est passé en son siége jusques au 29 (19 avril) de ce mois.;;;Bellay, Jacques;;1652;Paris;geonames:2988507;8;True
Moreau3019_GBOOKS;Le recit veritable de tout ce qui s'est fait & passé à la prise du pont de Charenton, par les troupes de son Altesse Royale, sous la conduite de monsieur de Briolle mareschal de camp, où tous ceux qui y estoient ont esté faits prisonniers.;;;Le Fèvre, Philippe;;1652;Paris;geonames:2988507;6;True
Moreau3024_GBOOKS;Recit veritable de tout ce qui s'est fait et passé en Parlement, le mercredy 16. octobre 1652. En presence de son Alt. Royale, et autres ducs & pairs de France. Avec la response du Roy à la derniere lettre & declaration de son Altesse Royale.;;;Toussaint, Laurent;;1652;Paris;geonames:2988507;6;True
Moreau2047_GBOOKS;Lettre de proverbes d'un messire abbé, voisin de Compiègne, au noble sire Jules Mazarin, cardinal, lui mandant tout ce qui s'est passé en France depuis son départ.;;;;;1652;Paris;geonames:2988507;16;False
Moreau2080_GBOOKS;Lettre des trois États de Provence à M. le duc de Guyse (sic), par laquelle il est prié d'accepter le gouvernement de la province, et (de) les tirer du joug tyrannique sous lequel ils languissent depuis la mort du défunt duc de Guyse, son père.;;;;;1652;Paris;geonames:2988507;7;True
Moreau88_GBOOKS;Antidote (l’) au venin des libelles du royaliste « Agathon et de la vérité nue.;;;;;1652;Paris;geonames:2988507;32;False
Moreau52_GBOOKS;Affiche : l’arbitre de la paix aux Parisiens.;;;;;1652;Paris;geonames:2988507;8;False
Moreau60_GBOOKS;Alliance (l) des armes et des lettres de monseigneur le Prince avec son panégyrique, présenté à son Altesse Royale.;;;;;1652;Paris;geonames:2988507;79;True
Moreau38_GBOOKS;Adieu (l') de la France au cardinal Mazarin;;;;;1652;Paris;geonames:2988507;6;True
Moreau1757_GBOOKS;Journal de tout ce qui s'est passé entre l'armée du roi, commandée par M. le comte d'Harcourt, et celle de monsieur le Prince, depuis le 22 février jusqu'à présent, avec les particularités et la marche de leurs armées ès pays de Guyenne, Périgord, Xaintonge et autres lieux.;;;Clément, Jacques;;1652;Paris;geonames:2988507;16;True
Moreau1716_GBOOKS;Intérêts (les) des peuples représentés à son Altesse Royale. Pièce d 'instruction, où le lecteur verra que c'est folie de se ruiner pour chasser le cardinal Mazarin, si l'on n 'insiste également à la diminution des tailles, gabelles, entrées des portes et autres impôts, et qu 'il ne faut point demander l'un sans l'autre.;;;;;1652;Paris;geonames:2988507;15;True
Moreau1768_GBOOKS;Jugement de Minos contre tous les mazarins qui pillent la France.;;;;;1652;Paris;geonames:2988507;16;True
Moreau1797_GBOOKS;Labyrinthe (le) de l'État, ou les Véritables causes des malheurs de la France, à Ctésiphon.;;;;;1652;Paris;geonames:2988507;36;False
Moreau1703_GBOOKS;Inquisition (l') recherchant exactement ce qu'on doit faire dans l'état présent des affaires.;;;;;1652;Paris;geonames:2988507;24;True
Moreau1722_GBOOKS;Interprète (l') du Caractère du royaliste montrant à Agathon quelle a été la conduite de monsieur Séguier, chancelier de France, dans tous ces (sic) emplois.;;;;;1652;Paris;geonames:2988507;15;True
Moreau1754_GBOOKS;Journal de tout ce qui s'est passé à Bordeaux, depuis le 1er juin jusques à présent, avec la liste de ceux qu'ils en ont fait sortir.;;;;;1652;Paris;geonames:2988507;7;True
Moreau3097_GBOOKS;Relation contenant la suite et conclusion du Journal de tout ce qui s'est passé au Parlement pour les affaires publiques, depuis Pâques 1652 jusqu'en janvier 1653.;;;Alliot, Gervais;isni:0000000121202363;1653;Paris;geonames:2988507;263;True
Moreau1225_GBOOKS;Entrée (l’) du roi dans son Parlement, pour la déclaration de sa majorité.;;;Jacquard, Nicolas;isni:0000000109088537;1654;Paris;geonames:2988507;15;False
Moreau906_GBOOKS;Déclaration du roi contre les princes de Condé, Conty, et duchesse de Longueville, les ducs de Nemours et de La Rochefoucault, et autres leurs adhérents qui les ont suivis, vérifiée en parlement, le 5 décembre 1651.;De Bourbon, Louis;isni:0000000121209573;;isni:0000000123698534;1654;Paris;geonames:2988507;34;False
Moreau960_GBOOKS;Décret criminel contre le cardinal Mazarin et ses partisans, sur sa sortie hors de France.;;;;;1654;Paris;geonames:2988507;8;False
Moreau3640_GBOOKS;Senèque (le) mourant, déclarant à sa mort le seul moyen d'avoir la paix, pourvu qu'on le veuille croire, en suite de la députation du Parlement, par le sieur Du Crest.;;;;;1662;Paris;geonames:2988507;31;True
Moreau3257_GBOOKS;Relation véritable de tout ce qui s'est passé à la marche de l'armée de monseigneur le duc de Beaufort et les avantages qu'il a déjà remportés sur les Mazarins.;;;L'Allemant, Jean;isni:0000000106549641;;Paris;geonames:2988507;7;False
Moreau977_GBOOKS;Défaite (la) des troupes du sieur de Biron par celles de monsieur le Prince, sous la conduite du comte de Marchin (sic), ensemble d’autres particulavités des victoires passées.;;;Vivenay, Nicolas;isni:0000000121408134;;Paris;geonames:2988507;8;True
Moreau950_GBOOKS;Déclaration du roi pour le rétablissement du parlement en la ville de Paris, vérifiée en parlement, toutes, les chambres assemblées au château du Louvre, publiée, le roi y séant, le 22 octobre 1652.;De Bourbon, Louis;isni:0000000121209573;;isni:0000000123698534;;Paris;geonames:2988507;7;True
Moreau937_GBOOKS;Déclaration du roi, portant révocation de toutes commissions extraordinaires, même celles d’intendants des justices (sic) ès provinces du royaume, avec décharge, à ses sujets, des restes des tailles avant l’année 1647, et remise d’un demi quartier d’icelles pour les années 1648 et 1649, vérifiée en parlement , le 18 juillet 1648.;De Bourbon, Louis;isni:0000000121209573;;isni:0000000123698534;;Paris;geonames:2988507;11;True
Moreau2290_GBOOKS;Lettres monitoires de monsieur l'official de l'archevêché de Paris pour avoir preuve des contraventions faites par un certain quidan et ses adhérents à l'exécution des arrêts de la cour, des 7, 9, 20 février et 2 mars 1651.;;isni:0000000121814044;;isni:0000000123698534;;Paris;geonames:2988507;6;True
Moreau955_GBOOKS;Déclaration faite par Son Altesse Royale et par M. le Prince dans le Parlement, chambre des Comptes, cour des Aydes et Maison de ville de Paris, sur le sujet de l'éloignement du cardinal Mazarin.;d'Orléans, Gaston;isni:0000000121336441;Guillemot, (veuve de Jean);isni:0000000359773502;;Paris;geonames:2988507;7;False
Moreau3248_GBOOKS;Relation véritable de tout ce qui s'est fait et passé à la prise des châteaux de Linchamp et Château Regnault, proche Charleville, par le marquis de Noir-montier (sic), et la prise du sieur de Saint- Etienne fils, gouverneur, avec le nombre de ceux qui ont été tués et blessés.;La Trémoille (de), Louis;;;;;Paris;geonames:2988507;6;False
Moreau3145_GBOOKS;Relation de tout ce qui s'est fait et passé en la ville de Bordeaux et province de Guyenne, et la réponse faite par le roi aux députés dudit Parlement et ville de Bordeaux, depuis l'arrivée desdits députés en la ville de Libourne, le 3 août 1650, jusques au 12 dudit mois, ensemble la prise de l'île Saint-Georges, avec les nouvelles apportées à Leurs Majestés, du 12 août 1650, du secours arrivé à Porto-Longone de la galère commandée par le lieutenant du chevalier de Châtellus (sic), renforcée de 510 hommes de guerre, argent et munitions, et la défaite de 1500 paysans révoltés en Catalogne, envoyée à M. le maréchal de Lhôpital.;;;;;;Paris;geonames:2988507;8;True
Moreau3251_GBOOKS;Relation véritable de tout ce qui s'est fait et passé aux barricades de Paris, le vingt-sixième, le vingt-septième et vingt-huitième d'août mil six cent quarante- huit.;;;;;;Paris;geonames:2988507;8;True
Moreau2suppl112_GBOOKS;Lettre d’un gentilhomme de la cour à uu seigneur qui est à l'armée, tonchant l’attentat commis aux Filles-Dieu à Paris, en la personne de mademoiselle de Sainte-Croix, etc.;;;Hénavet, Jean;;;Paris;geonames:2988507;20;True
Moreau382_GALL;Arrêt (l') du conseil d’en haut, prononcé par le prophète royal David, contre Mazarin et les partisans par F. M. S. D. R.;;;;;;Paris;geonames:2988507;8;True
Moreau3030_GBOOKS;Recit veritable des discours tenus entre les trois figures qui sont sur le Pont au Change, sur les affaires de ce temps.;;;Targa, Pierre;isni:000000000183047X;1649;Sans Lieu;geonames:2988507;7;True
Moreau577_GALL;Bataille (la) de Lens;de la Peyrère, Isaac;isni:0000000110638153;Cramoisy, Sébastien;isni:0000000423421174;1649;Sans Lieu;geonames:2988507;22;True
Moreau2096_GBOOKS;Lettre du cardinal Mazarin, envoyée à la reine touchant sa sortie hors du royaume, du 6 mars 1651.;Mazarin, Jules;isni:0000000121223121;;;1651;Sans Lieu;geonames:2988507;6;False
Moreau3911_GBOOKS;Union des trois Parlements de Toulouse, de Bordeaux et de Provence.;;;;;1649;Toulouse;geonames:2988507;8;True
Moreau412_MAZ;Articles de la paix, accordés entre messieurs du parlement de Bordeaux et monsieur d'Argençon (sic);;isni:0000000383255772;Hotot, Gilles;isni:0000000364426759;1649;Orléans;geonames:2989317;4;False
M15436-3_MAZ;Lettre du Roy, escrite a monseigneur le marquis de Sourdis, gouverneur d'Orleans, &c. Touchant les particularitez de la paix concluë & arrestée, & la marche de l'armée de l'archiduc Leopold.;;isni:0000000383255772;Hotot, Gilles;isni:0000000364426759;1649;Orléans;geonames:2989317;4;False
M15436-4_MAZ;Lettre escrite a messieurs les maire et eschevins de la ville d'Orleans. Touchant la confirmation de la paix.;Fromont, Roger-François de;viaf:1592152636232020052692;Hotot, Gilles;isni:0000000364426759;1649;Orléans;geonames:2989317;4;False
M15436-35_MAZ;L'accommodement des habitans de Bordeaux avec le duc d'Espernon.;;;Hotot, Gilles;isni:0000000364426759;1649;Orléans;geonames:2989317;4;True
Moreau4044_MAZ;Vive le roi! (le) des Parisiens sur le retour de son (sic) glorieux monarque Louis XIVᵉ de ce nom, par N. J. T. (Nicolas Jamin, Tourangeau).;Jamin, Nicolas;isni:0000000114743022;;;1649;Orléans;geonames:2989317;4;True
Moreau783_MAZ;Contrat(le) de mariage du parlement avec la ville de Paris.;;;;;1649;Orléans;geonames:2989317;16;True
Moreau2661_MAZ;Panégyrique (le) de monseigneur le duc de Beaufort, pair de France.;;;Paris, Maria;FRBNF:17146624;1650;Orléans;geonames:2989317;4;False
Moreau1452-i_MAZ;Frondeur (le) désintéressé.;Laffemas, Isaac de;isni:0000000080867659;Hotot, Gilles;isni:0000000364426759;1650;Orléans;geonames:2989317;12;True
Moreau2197_MAZ;Lettre du roi sur la détention des princes de Condé, de Conty et duc de Longueville, envoyée au Parlement, le 20 janvier 1650.;Mazarin, Jules;isni:0000000121223121;Hotot, Gilles;isni:0000000364426759;1650;Orléans;geonames:2989317;12;True
Moreau3399_MAZ;Reponse de messieurs les princes aux calomnies et impostures de Mazarin.;Machon, Louis;isni:000000001027361X;;;1650;Orléans;geonames:2989317;35;True
M15438-40_MAZ;Lettre du duc d'Espernon, envoyée aux jurats de Bourdeaux, touchant ce qui se passe entre son armée & celle du duc de Boüillon.;Épernon, Bernard de Nogaret de La Valette;isni:0000000061333950;;;1650;Orléans;geonames:2989317;4;True
Moreau3478_MAZ;Requête de mademoiselle de Longueville, fille de Henry d'Orléans, duc de Longueville, présentée à nos seigneurs de Parlement ( le 7 décembre 1650) touchant la mort de madame la princesse douairière de Condé et le transport de messieurs les princes du château de Vincennes à Marcoussi et au Hâvre et sur leur délivrance.;Nemours, Marie d'Orléans-Longueville;isni:0000000080818398;;;1650;Orléans;geonames:2989317;4;False
Moreau1917_MAZ;Lettre de consolation à madame la princese sur l'emprisonnement de monsieur le Prince.;Condé, Louis de Bourbon;isni:0000000121209573;;;1650;Orléans;geonames:2989317;4;True
Moreau2006_MAZ;Lettre de monseigneur le prince de Condé à messieurs de Paris.;Condé, Louis de Bourbon;isni:0000000121209573;;;1650;Orléans;geonames:2989317;4;True
Moreau1320_MAZ;Examen (l') des princes pour gagner le jubilé dans le bois de Vincennes.;;;;;1650;Orléans;geonames:2989317;8;False
Moreau805_MAZ;Coup (le) de foudre ou l’Écho du bois de Vincennes.;;;;;1650;Orléans;geonames:2989317;4;True
Moreau3743_MAZ;Tableau (le) de l'ingratitude de monsieur le Prince, présenté à monsieur le duc de Beaufort.;;;;;1650;Orléans;geonames:2989317;3;True
M15438-36_MAZ;La prise et reduction de la ville de Clermont en Lorraine, par l'armée du Roy, commandée par monsieur le marquis de Seneterre. Avec la reconnoissance faite par leurs Majestez à ceux qui ont esté employé en cette action.;;;;;1650;Orléans;geonames:2989317;7;True
M15436-66_MAZ;Harangue et remerciement fait au Roy par les Bordelois, sur le sujet de la paix, avec ses articles.;;;;;1650;Orléans;geonames:2989317;4;False
M15438-45_MAZ;Relation de ce qui s'est n'agueres passé à Tolose, sur la reception des lettres du Roy, portées par le chevalier de Terlon. Avec defenses de lever aucuns gens de guerre sans permission du Roy.;;;;;1650;Orléans;geonames:2989317;4;True
M15438-46_MAZ;Harangue faite a madame la duchesse d'Orleans sur l'heureuse naissance de monseigneur le Prince son fils. Par un docte et celebre personnage d'Orleans.;;;;;1650;Orléans;geonames:2989317;4;False
Moreau2340_MAZ;Magnificat (le) de la reine sur la détention des princes.;;;;;1650;Orléans;geonames:2989317;4;True
Moreau42_MAZ;Adieu (l’) des écrivains, triolets.;;;;;1650;Orléans;geonames:2989317;4;False
Moreau289_MAZ;Arrêt de la cour de parlement, pour la liberté de messieurs les princes et l’éloignement du cardinal Mazarin hors du royaume de France.;;isni:0000000121755355;Paris, Maria;FRBNF:17146624;1651;Orléans;geonames:2989317;4;False
Moreau915_MAZ;Déclaration du roi en faveur de madame la duchesse de Longueville, de M. le maréchal de Turenne et de tous ceux qui ont suivi ou exécuté leurs ordres, vérifiée en parlement, le 19 mai 1651.;;isni:0000000121755355;Paris, Maria;FRBNF:17146624;1651;Orléans;geonames:2989317;7;False
M15439-24_MAZ;Relation de ce qui s'est fait & passé à Paris, au sujet de l'éloignement du cardinal Mazarin, avec la liberté & sortie des Princes hors du Havre de Grace, par ordre & commandement de sa Majesté.;;;;;1651;Orléans;geonames:2989317;4;False
Moreau1543_GALL;Harangue burlesque faite à Mademoiselle, au nom des bateliers d'Orléans, contenant le narré de son entrée dans la ville.;Dangerville;viaf:27219264;Hotot, Gilles;isni:0000000364426759;1652;Orléans;geonames:2989317;11;True
Moreau3018_GBOOKS;Récit véritable de tout ce qui s'est fait et passé à l'entrée du roi en la ville d'Auxerre, avec les harangues faites à Leurs Majestés par messieurs du clergé de ladite ville.;;;Candy, Jean-Aymé;isni:0000000121202486;1650;Lyon;geonames:2996944;12;True
Moreau2208_GBOOKS;Lettre écrite à monseigneur l'archevêque d'Ambrun (sic) par un clerc de son diocèse, sur l'opposition formée au sceau par l'assemblée du clergé de France, tenue à Paris, et signée de lui, à la déclaration du roi poursuivie et depuis obtenue et vérifiée par le Parlement de Paris pour exclure les cardinaux, même françois, de l'entrée du conseil du roi.;;;;;1651;Embrun;geonames:3020251;23;True
Moreau958_GBOOKS;Déclaration sur le sujet et la forme de l’entrée de Son Altesse Impériale l’archiduc Léopold en France, et de sa retraite après l'accommodement fait entre la régence et le parlement de Paris avec les princes et seigneurs associés.;;;;;1649;Cambrai;geonames:3029030;8;False
Moreau3104_GBOOKS;Relation de Bordeaux contenant ce qui s'est passé, depuis la sortie de nos chaloupes, entre l'armée du Parlement et celle du duc d'Épernon jusques au 23 août.;;;;;1649;Bordeaux;geonames:3031582;12;True
Moreau2071_GBOOKS;Lettre des dames du Parlement de Bordeaux aux dames du Parlement de Paris, contenant les remercîments de leur entremise pour la paix, avec un récit véritable de tout ce qui s'étoit passé au dedans et au dehors de la ville de Bordeaux pendant le siége, écrite pendant la trève.;;isni:0000000119572170;;;1650;Bordeaux;geonames:3031582;18;False
Moreau3152_GBOOKS;Relation des avantages remportés par l'armée de monseigneur le Prince sur les troupes de monsieur le comte d'Harcourt.;;;La Court (De), Guillaume;isni:0000000121290076;1651;Bordeaux;geonames:3031582;8;False
Moreau342_GBOOKS;Arrêt de la cour de parlement de Provence contre les perturbateurs du repos et tranquillité publique.;;isni:0000000121732655;;;1649;Aix-en-Provence;geonames:3038354;8;True
Moreau3suppl5_GBOOKS;Altra relatione della morte barbara e crudele del re d'Inghilterra, e con maggiore distintione di particolarità trovate più vere, e con notitia della risolutione della Scotia e Irlandia.;;;Ferrofino, Francesco;isni:0000000000579981;1649;Torino;geonames:3165524;8;True
M15259_MAZ;Arrest de la cour de parlement de Bourdeax [sic]. Du quinziesme jour de juin 1649. Portant cassation de l'arrest du dix-huictiesme de mars 1649. donné par la Cour des aydes.;;isni:0000000119572170;Mongiron Millanges, Jacques;isni:0000000121390552;1649;Bordeaux;geonames:6455058;7;False
Labadie66_MAZ;ARREST de la Cour de Parlement de Bourdeaux;;isni:0000000119572170;Mongiron Millanges, Jacques;isni:0000000121390552;1649;Bordeaux;geonames:6455058;4;True
Labadie58_MAZ;ARREST de la Cour de Parlement de Bourdeaux;;isni:0000000119572170;Mongiron Millanges, Jacques;isni:0000000121390552;1649;Bordeaux;geonames:6455058;7;True
Labadie63_MAZ;ARREST de la Cour de Parlement de Bourdeaux;;isni:0000000119572170;Mongiron Millanges, Jacques;isni:0000000121390552;1649;Bordeaux;geonames:6455058;4;True
Moreau929_GBOOKS;Déclaration du roi, portant interdiction du parlement de Bourdeaux, donnée à Compiègne, le 12 juillet 1649.;De Bourbon, Louis;isni:0000000121209573;;;1649;Bordeaux;geonames:6455058;15;True
Moreau2360_MAZ;Manifeste de la ville d'Aix sur les mouvements de cette province.;;;;;1649;Bordeaux;geonames:6455058;7;True
Moreau182_MAZ;Arrêt de la cour de parlement de Bordeaux, portant que les maîtres boulangers de la présente ville achèteront des blés, pour faire magasin et les convertir en farines , pour les nécessités du public.;;isni:0000000119572170;Mongiron Millanges, Jacques;isni:0000000121390552;1650;Bordeaux;geonames:6455058;4;True
Moreau180_MAZ;Arrêt de la cour de parlement de Bordeaux , portant que le roi sera très-humblement supplié d'agréer que madame la princesse de Condé et monsieur le duc d'Anguien (sic), son fils, demeureront en la présente ville, sous sa sauvegarde et de sa justice, avec le registre y mentionné.;;isni:0000000119572170;Mongiron Millanges, Jacques;isni:0000000121390552;1650;Bordeaux;geonames:6455058;8;False
Moreau181_MAZ;Arrêt de la cour de parlement de Bordeaux, portant que le sieur duc d’Épernon, le chevalier de La Valette, son frère, et leurs adhérans (sic) sont déclarés infracteurs de la paix, perturbateurs du repos publie, ennemis du roi et de son État.;;isni:0000000119572170;Mongiron Millanges, Jacques;isni:0000000121390552;1650;Bordeaux;geonames:6455058;8;False
Moreau902_GBOOKS;Déclaration du roi, accordée à son parlement et ville de Bordeaux, du 1er octobre 1650, portant amnistie générale de ce qui a été fait depuis la dernière déclaration de Sa Majesté, du 26 décembre 1649, enregistrée en ladite cour le 7 janvier 1650, ensemble les Propositions de monseigneur le duc d’Orléans, registres du parlement de Paris, lettres de Sadite Majesté, portant approbation d'iceux et révocation de M. le duc d'Épernon du gouvernement de Guyenne, avec l'Arrêt d'enregistrement et de publication.;De Bourbon, Louis;isni:0000000121209573;Mongiron Milanges, J.;isni:0000000121390552;1650;Bordeaux;geonames:6455058;12;False
Moreau1suppl143_MAZ;Lettre de la cour de parlement de Bourdeaux escrite à la cour de parlement de Paris;;isni:0000000119572170;;;1650;Bordeaux;geonames:6455058;4;True
Moreau4045_GBOOKS;Vœu (le) des bons Bordelois fait à monseigneur le prince de Condé, gouverneur de Guyenne.;;;Preuveray, François;isni:0000000121259642;1651;Bordeaux;geonames:6455058;8;True
Moreau3977_GBOOKS;Véritables raisons de l'union du Parlement de Bordeaux avec monsieur le Prince, adressées au roi.;;isni:0000000119572170;Court (de La), Guillaume;isni:0000000121290076;1651;Bordeaux;geonames:6455058;15;True
