id;title;author;author_id;publisher;publisher_id;date;pubPlace;pubPlace_id;pages;stamp
Moreau2394_GBOOKS;Manifeste du roi de la Grand'Bretagne à ses sujets du royaume d'Angleterre.;;isni:0000000118675506;Preuveray, François;isni:0000000121259642;1649;Paris;geonames:2988507;8;True
Moreau3925_GBOOKS;Véritable (la) conduite du courtisan généreux.;;;Preuveray, Jean;isni:0000000121259642;1649;Paris;geonames:2988507;14;True
Moreau127_MAZ;Apologie pour monseigneur le cardinal Mazarin, tirée d’une conférence entre son éminence et monsieur ***, homme de probité et excellent casuiste, tenue à Saint-Germain, deux jours consécutifs. Première journée.;;;Preuveray, François;isni:0000000121259642;1649;Paris;geonames:2988507;39;True
Moreau3241_GBOOKS;Relation véritable de la mort barbare et cruelle du roi d ' Angleterre, arrivée à Londres le 8 février 1649.;;;Preuveray, François;isni:0000000121259642;1649;Paris;geonames:2988507;8;True
Moreau2548_GBOOKS;Nouvelle extraordinaire touchant l'état présent des affaires du roi de la Grand'Bretagne, avec deux harangues éloquentes et zélées sur le dessein de venger le meurtre du roi défunt et assurer le roi d'à présent dans ses États, l'une prononcée par le chevalier Richard Blaque de la part de l'assemblée des trois États du parti catholique d'Irlande, et l'autre par monseigneur le marquis d'Ormond, vice-roi du même royaume.;;;Preuveray, François;isni:0000000121259642;1649;Paris;geonames:2988507;8;True
Moreau1817_GBOOKS;Lettre circulaire, contenant un charitable avis à quelques villes de Champagne et Picardie, pour les inciter de se résoudre à prendre le bon parti du roi et du Parlement, du 12 février 1649.;;;Preuveray, François;isni:0000000121259642;1649;Paris;geonames:2988507;7;False
Moreau1217_GBOOKS;Enfer (l'), le purgatoire et le paradis temporel de la France.;;;Preuveray, François;isni:0000000121259642;1649;Paris;geonames:2988507;8;True
Moreau2967_MAZ;Raisons (les) ou les Motifs véritables de la défense du Parlement et des habitants de Paris contre les perturbateurs du repos public et les ennemis du roi et de l'État.;;;Preuveray, François;isni:0000000121259642;1649;Paris;geonames:2988507;16;True
Moreau2447_GBOOKS;Mémoires et plaintes des rentiers de l'Hôtel de Ville de Paris sur les contraventions aux arrêts, réglements et déclaration d'octobre 1648, présentés à nos seigneurs du Parlement.;;;Pépingué, Edme;isni:0000000121284039;1649;Paris;geonames:2988507;23;True
Moreau1724_GBOOKS;Intrigue (l') des soldats de l'armée de Mazarin avec les filles de joie de Paris, nouvellement découverte par des lettres interceptées par la garde de la porte Saint-Honoré, et la réponse sur le même sujet, où se voit la misère de l'armée mazariniste, et ce qui s'y passe de plus remarquable.;;;Chenault, Charles;isni:0000000121327895;1649;Paris;geonames:2988507;4;False
Moreau1178_GBOOKS;Écho de la France troublée par le déguisé Mazarin, représenté par la figure d’un ours, par le sieur Barroys.;Barrois, H.de;isni:0000000061693956;Vivenay, Nicolas;isni:0000000121408134;1649;Paris;geonames:2988507;8;True
Moreau2084_GBOOKS;Lettre du C. D. Retz envoyée au cardinal Mazarin sur le sujet de son éloignement.;Gondi (De), Jean-François;isni:0000000061512983;Vaillant, Nicolas;isni:0000000122510296;1649;Paris;geonames:2988507;14;True
Moreau151_MAZ;Arrêt de la cour des Aydes, portant vérification de la déclaration de Sa Majesté, donné pour faire cesser les mouvements et pour rétablir le repos et la tranquillité en son royaume.;;isni:0000000115476931;;isni:0000000123698534;1649;Paris;geonames:2988507;3;True
Moreau258_MAZ;Arrêt de la cour de parlement, sur la proposition, faite par monseigneur le prince de Conty, pour l’éloignement du cardinal Mazarin.;Conti, Armand de Bourbon;isni:0000000119302891;;isni:0000000123698534;1649;Paris;geonames:2988507;4;True
Moreau954_MAZ;Déclaration, faite en Parlement par monseigneur le prince de Conty et messieurs les généraux contre le cardinal Mazarin.;Conti, Armand de Bourbon;isni:0000000119302891;;isni:0000000123698534;1649;Paris;geonames:2988507;4;False
Moreau2273_GBOOKS;Lettres de monsieur le duc de Longueville et de messieurs du Parlement de Normandie, envoyées à messieurs du Parlement de Paris, avec cinq divers arrêts donnés et envoyés pour le service du roi par ladite cour de Normandie sur les affaires de ce temps, du mois de février 1649.;Longueville, Henri de;isni:0000000121350921;;isni:0000000123698534;1649;Paris;geonames:2988507;12;True
Moreau3921_GBOOKS;Véritable (le) arrêt de la cour de Parlement en faveur de monsieur le maréchal de Turenne.;;isni:0000000121755355;;isni:0000000123698534;1649;Paris;geonames:2988507;4;True
Moreau1356_GBOOKS;"Extraits des registres du Parlement, contenant la harangue faite au roi et à la reine régente par M. Talon, avocat général, avec son rapport, audit Parlement, de la réponse de Leurs Majestés; ensemble la lettre de l'archiduc Léopold, les propositions de l'envoyé de sa part, et arrêts de la cour sur ce sujet, du 19 février 1649.";;isni:0000000121755355;;isni:0000000123698534;1649;Paris;geonames:2988507;8;True
Moreau242_MAZ;Arrêt de la cour de parlement, pour empêcher le divertissement des deniers des tailles, subsistances, fermes, aides, gabelles et autres deniers de Sa Majesté, ordonnés, par précédents arrêts de ladite cour, être portés en l’Hôtel de Ville de Paris.;;isni:0000000121755355;;isni:0000000123698534;1649;Paris;geonames:2988507;4;True
Moreau220_MAZ;Arrêt de la cour de parlement, toutes les chambres assemblées, le dixième jour de janvier 1649;;isni:0000000121755355;;isni:0000000123698534;1649;Paris;geonames:2988507;4;True
Moreau265_GBOOKS;Arrêt de la cour de parlement, en faveur des locataires et sous-locataires des maisons de la ville et fauxbourgs de Paris, pour leur décharge du loyer de Pâques dernier, avec règlement pour les baux, rentes foncières et autres, constituées pour la construction des bâtiments, donné sur les requêtes des propriétaires desdites maisons, et pour l’exécution des arrêts précédents des 10 et 14 présents mois et an.;;isni:0000000121755355;;isni:0000000123698534;1649;Paris;geonames:2988507;4;False
Moreau230_MAZ;Arrêt de la cour de parlement, du 25 janvier 1649, par lequel il est ordonné, aux payeurs des rentes, de payer les arrérages dus et échus aux rentiers, qui sont présents en cette ville.;;isni:0000000121755355;;isni:0000000123698534;1649;Paris;geonames:2988507;3;True
Moreau216_MAZ;Arrêt de la cour de parlement , donné , toutes les “ chambres assemblées , le sixième jour de janvier 1649, pour la sûreté et police de la ville de Paris;;isni:0000000121755355;;isni:0000000123698534;1649;Paris;geonames:2988507;4;False
Moreau239_MAZ;Arrêt de la cour de parlement, portant que les deniers de la recette générale de Reims seront apportés en cette ville et mis ès coffres de l’hôtel d’icelle.;;isni:0000000121755355;;isni:0000000123698534;1649;Paris;geonames:2988507;4;True
Moreau229_MAZ;Arrêt de la cour de parlement, portant défenses, aux gens de guerre, de commettre aucunes violences, voleries, pillages, incendies et autres actes d’hostilité sur les sujets du roi et habitants des villes, bourgs, bourgades et villages ès environs de Paris et ailleurs, à peine de la vie.;;isni:0000000121755355;;isni:0000000123698534;1649;Paris;geonames:2988507;4;True
Moreau217_MAZ;Arrêt de la cour de parlement , donné, toutes les chambres assemblées, le huitième jour de janvier 1649, par lequel il est ordonné, que le cardinal Mazarin videra le royaume, et qu’il sera fait levée de gens de guerre, pour la sûreté de la ville et pour faire amener et apporter sûrement et librement les vivres à Paris;;isni:0000000121755355;;isni:0000000123698534;1649;Paris;geonames:2988507;4;True
Moreau224_GBOOKS;Arrêt de la cour de parlement, portant que tous les biens meubles ou immeubles et revenus des bénéfices du cardinal Mazarin seront saisis, et commissaires, séquestres et gardiens commis à iceux.;;isni:0000000121755355;;isni:0000000123698534;1649;Paris;geonames:2988507;4;True
Moreau228_MAZ;Arrêt de la cour de parlement, portant défenses, à toutes personnes en cette ville et faubourgs de Paris, de changer leurs noms et de se travestir et déguiser pour sortir de ladite ville, sur peine de la vie.;;isni:0000000121755355;;isni:0000000123698534;1649;Paris;geonames:2988507;3;True
Moreau238_MAZ;Arrêt de la cour de parlement, portant que les quarante-six mille livres, provenant de la recette générale de l'Auvergne, seront apportées dans cette ville, et mis ès coffres de l’hôtel d’icelle.;;isni:0000000121755355;;isni:0000000123698534;1649;Paris;geonames:2988507;4;False
Moreau257_GBOOKS;Arrêt de la cour de parlement, sur l'avis que monseigneur le prince de Conty a donné, de l'entrée de l'archiduc Léopold en France.;;isni:0000000121755355;;isni:0000000123698534;1649;Paris;geonames:2988507;4;False
Moreau243_MAZ;Arrêt de la cour de parlement, portant défenses, aux officiers du présidial , prévôté, maire et échevins d'Orléans, de connaître et juger d’autres matières que de celles à eux attribuées par les édits du roi, vérifiés en ladite cour.;;isni:0000000121755355;;isni:0000000123698534;1649;Paris;geonames:2988507;4;True
Moreau221_MAZ;"Arrêt de la cour de parlement, donné, toutes les chambres assemblées , le 10 janvier 1649, par lequel il est défendu, à tous gouverneurs des villes frontières ou autres places, de laisser sortir aucuns canons, armes et munitions de guerre de leurs dites places, et enjoint, à tous capitaines, soldats et gens de guerre, qui sont proches de Paris, de s’en éloigner de vingt lieues ; à faute de ce, permis aux habitants des villes, bourgs et villages, de s’armer et leur courir sus";;isni:0000000121755355;;isni:0000000123698534;1649;Paris;geonames:2988507;4;True
Moreau248_MAZ;Arrêt de la cour de parlement, par lequel il est enjoint, à tous les quartiniers de la ville de Paris, de porter ou envoyer ès mains de Sébastien Cramoisy et Jean-Baptiste Forne, toutes les taxes, par eux reçues, et celles qu’ils recevront ci-après des particuliers, habitants de ladite ville.;;isni:0000000121755355;;isni:0000000123698534;1649;Paris;geonames:2988507;3;False
Moreau255-bad_GBOOKS;Arrêt de la cour de parlement, portant que tous ceux qui sont compris ès rôles de modérations pour l’armement et subsistance des gens de guerre, demeureront déchus desdites modérations, et seront contraints de payer leurs taxes par emprisonnement de leurs personnes,et les autres particuliers, y dénommés, contraints par la vente de leurs biens.;;isni:0000000121755355;;isni:0000000123698534;1649;Paris;geonames:2988507;4;True
Moreau223_MAZ;Arrêt de la cour de parlement, concernant les retranchements pour la sûreté de la ville et faubourgs de Paris;;isni:0000000121755355;;isni:0000000123698534;1649;Paris;geonames:2988507;4;True
Moreau233_MAZ;Arrêt de la cour de parlement, portant qu’ouverture sera faite de toutes les chambres de la maison du cardinal Mazarin, et description sommaire de tout ce qui se trouvera dans ladite maison.;;isni:0000000121755355;;isni:0000000123698534;1649;Paris;geonames:2988507;4;True
Moreau241_MAZ;Arrêt de la cour de parlement, pour la validité de tous contrats, obligations et autres actes, faits et passés en cette ville de Paris entre tous particuliers et communautés.;;isni:0000000121755355;;isni:0000000123698534;1649;Paris;geonames:2988507;4;True
Moreau232_MAZ;Arrèt de la cour de Parlement, portant défenses, à tous imprimeurs et colporteurs, d’imprimer et exposer en vente aucuns ouvrages et autres écrits concernant les affaires publiques, sans permission registrée augreffe de ladite cour, sur peines y contenues.;;isni:0000000121755355;;isni:0000000123698534;1649;Paris;geonames:2988507;4;True
Moreau222_MAZ;Arrêt de la cour de parlement, contre les gens de guerre, qui ont quitté les frontières pour empêcher les vivres en cette ville, avec injonction aux communes de courre sus, publié l’onzième jour de janvier 1649;;isni:0000000121755355;;isni:0000000123698534;1649;Paris;geonames:2988507;4;True
Moreau250_MAZ;"Arrêt de la cour de parlement, portant qu’il sera fait recherche des moyens d’avoir argent, pour l’armement et subsistance des gens de guerre, avec défense, aux habitants, de payer aucunes tailles ni autres taxes ; et en cas de contravention , qu’il sera procédé par voie de représailles.";;isni:0000000121755355;;isni:0000000123698534;1649;Paris;geonames:2988507;4;True
Moreau240_MAZ;Arrêt de la cour de parlement, portant défenses, à tous quinqualiers (sic), armuriers et autres marchands de cette ville et faubourgs de Paris, de cacher, recéler ou détourner les armes qu’ils ont en leur possession, avec injonction de faire leur déclaration, au greffe de ladite cour, de la quantité qu’ils en ont.;;isni:0000000121755355;;isni:0000000123698534;1649;Paris;geonames:2988507;4;True
Moreau249_MAZ;Arrêt de la cour de parlement, portant défenses, à tous soldats et autres personnes , de quelque qualité qu'elles soient, d'aller, ès maisons des particuliers, habitants de cette ville et fauxbourgs, demander aucuns deniers, si ce n'est en la présence de deux conseillers de ladite cour.;;isni:0000000121755355;;isni:0000000123698534;1649;Paris;geonames:2988507;3;True
Moreau227_MAZ;Arrêt de la cour de parlement , portant que tous les deniers publics, qui seront dus par les comptables et fermiers, tant de cette ville de Paris qu’autres de ce ressort, seront saisis et mis ès coffres de l’Hôtel de Ville.;;isni:0000000121755355;;isni:0000000123698534;1649;Paris;geonames:2988507;3;False
Moreau245_MAZ;Arrêt de la cour de parlement portant que les arrêts de ladite cour et ordonnances des commissaires, commis pour les taxes, seront exécutés, et les gens d’affaires et traitants contraints au payement desdites taxes par emprisonnement.;;isni:0000000121755355;;isni:0000000123698534;1649;Paris;geonames:2988507;4;True
Moreau236_MAZ;Arrêt de la cour de parlement, du 30 janvier 1649, portant règlement pour le prix des mousquets avec bandoulières, picques (sic), paire d'armes avec le pot, pistolets avec les foureaux, poudre, plomb et mesche (sic).;;isni:0000000121755355;;isni:0000000123698534;1649;Paris;geonames:2988507;4;True
Moreau219_MAZ;Arrêt de la cour de parlement, concernant la levée des deniers pour le payement des gens de guerre, du 9 janvier 1649.;;isni:0000000121755355;;isni:0000000123698534;1649;Paris;geonames:2988507;4;True
Moreau218-bad_GBOOKS;Arrêt de la cour de parlement, toutes les chambres assemblées;;isni:0000000121755355;;isni:0000000123698534;1649;Paris;geonames:2988507;4;True
Moreau246_MAZ;Arrêt de la cour de parlement, portant que les meubles, étans (sic) en la maison du cardinal Mazarin, seront vendus.;;isni:0000000121755355;;isni:0000000123698534;1649;Paris;geonames:2988507;4;True
Moreau254_GBOOKS;Arrêt de la cour de parlement, portant défenses, à tous gentilshommes et autres, de faire aucunes levées de gens de guerre dans les provinces, qu'en vertu de commissions du roi et attaches de ladite cour sur icelles, à peine de la vie et d'être dégradés de noblesse, et, à tous receveurs et comptables, de délivrer aucuns deniers ni s'en dessaisir, que par ordre de ladite cour, à peine du quadruple, et en cas de contravention, enjoint, aux communes, de s'assembler à son du tocsin et de leur courir sus.;;isni:0000000121755355;;isni:0000000123698534;1649;Paris;geonames:2988507;4;True
Moreau263_GBOOKS;Arrêt de la cour de parlement, portant injonction, à tous les sujets du roi, d’obéir à la déclaration du mois de mars dernier, et aux troupes, étant dans l’Anjou et autres lieux, de poser les armes, avec défense de commettre aucuns actes d'hostilité, sous peine d’être déclarés perturbateurs du repos public.;;isni:0000000121755355;;isni:0000000123698534;1649;Paris;geonames:2988507;4;False
Moreau251_GBOOKS;Arrêts de la cour de parlement, pour l’ouverture de la conférence et passage des vivres et autres choses nécessaires en cette ville de Paris, avec députation d’ancuns présidents en ladite cour et autres y dénommés, pour traiter et résoudre de tout ce qui sera utile et nécessaire à cet effet en ladite conférence, pour la paix générale et soulagement des peuples.;;isni:0000000121755355;;isni:0000000123698534;1649;Paris;geonames:2988507;4;False
Moreau203_MAZ;Arréêt de la cour de parlement, du 8 janvier 1592, pour la diminution des baux et loyers des maisons en la ville et faubourgs de Paris.;;isni:0000000121755355;;isni:0000000123698534;1649;Paris;geonames:2988507;4;False
Moreau247_MAZ;Arrêt de la cour de parlement, portant que taxes seront faites sur tous les secrétaires, avocats, procureurs et autres particuliers, habitants de cette ville et fauxbourgs de Paris, comme bourgeois, pour la subsistance des gens de guerre.;;isni:0000000121755355;;isni:0000000123698534;1649;Paris;geonames:2988507;3;True
Moreau235_MAZ;Arrêt de la cour de parlement, portant défenses, à tous colonels, capitaines, lieutenants, officiers et gardes des portes de cette ville de Paris, de laisser passer aucunes personnes, de quelque qualité et condition qu'elles soient, avec passeport, que par les portes Saint-Jacques et Saint-Denys.;;isni:0000000121755355;;isni:0000000123698534;1649;Paris;geonames:2988507;4;True
Moreau225_MAZ;Arrêt de la cour de parlement, portant injonction, à tous marchands et artisans de cette ville et faubourgs de Paris, de tenir leurs boutiques ouvertes et continuer leurs trafics , ainsi qu’il est accoutumé.;;isni:0000000121755355;;isni:0000000123698534;1649;Paris;geonames:2988507;4;False
Moreau1936_GBOOKS;Lettre de la cour de Parlement de Paris, envoyée aux parlements du royaume, du 18 janvier 1649.;;isni:0000000121755355;;isni:0000000123698534;1649;Paris;geonames:2988507;6;True
Moreau1935_GBOOKS;Lettre de la cour de Parlement de Paris, envoyée aux baillifs, sénéchaux, maires, échevins et autres officiers de ce royaume, du 18 janvier 1649.;;isni:0000000121755355;;isni:0000000123698534;1649;Paris;geonames:2988507;4;True
Moreau3049_GALL;Recueil des arrests remonstrances et lettres tant du Parlement & Cour des aydes de Paris, que du Parlement de Roüen. Ensemble le recueil des ordonnances & commissions de messieurs les prevost des marchands & eschevins de la ville de Paris, concernant la levée des gens de guerre & deniers pour leur subsistance, seureté & police de ladite ville de Paris. Depuis les mouvemens commencez au sixiéme janvier dernier, jusques à la pacification d'iceux.;;isni:0000000121755355;;isni:0000000123698534;1649;Paris;geonames:2988507;114;True
Moreau196_MAZ;Arrêt de la cour de parlement de Bretagne, donné les semestres assembles, touchant la convocation des états généraux du royaume et particuliers de la province.;;isni:0000000123225884;;isni:0000000123698534;1649;Paris;geonames:2988507;4;True
Moreau2287_GBOOKS;Lettres et arrêts de la cour de Parlement de Normandie envoyés à la cour de Parlement de Paris pour l'adjonction (sic) desdites cours et affaires présentes, avec l'arrêt portant ladite adjonction, du 5 février 1649.;;isni:0000000480502587;;isni:0000000123698534;1649;Paris;geonames:2988507;16;True
Moreau3170_GBOOKS;Relation fidèle de ce qui s'est passé de plus remarquable au Parlement depuis 10 février 1649 jusquesà la fin du mois, envoyée aux provinces.;;;;isni:0000000123698534;1649;Paris;geonames:2988507;12;True
Moreau3117_GBOOKS;Relation de ce qui s'est passé à Paris depuis l'enlavement du roi jusqu'à présent, envoyée aux provinces.;;;;isni:0000000123698534;1649;Paris;geonames:2988507;8;False
Moreau1123_GBOOKS;Discours fait par les députés du parlement de Provence dans le parlement de Paris, toutes les chambres assemblées, ensemble la réponse de monsieur le premier président, avec l'arrêt de ladite cour, des 15 et 28 janvier 1649.;;;;isni:0000000123698534;1649;Paris;geonames:2988507;6;False
Moreau1886_GBOOKS;Lettre d'un milord d'Angleterre, écrite à la reine régente, à Saint-Germain-en-Laye, sur les affaires de France et d'Angleterre, traduite par le sieur Du Pelletier.;Du Pelletier, Pierre;isni:0000000073678147;Musnier, François;isni:0000000140388204;1649;Paris;geonames:2988507;8;True
Moreau3766_MAZ;Testament solennel du cardinal Mazarin par lui fait au temps des barricades et trouvé depuis sa sortie de Paris en son cabinet, daté du 29 août 1648, avec l'avertissement de la vente de ses biens, etc., suivant l'arrêt de la cour du mois précédent.;;isni:0000000121755355;Musnier, François;isni:0000000140388204;1649;Paris;geonames:2988507;16;True
Moreau1540_GBOOKS;Harangue à messieurs les échevins et bourgeois de Paris, touchant tout ce qui s'est passé depuis les barricades jusqu'à présent, par le sieur Drazor, Champenois.;;isni:000000038974880X;Musnier, François;isni:0000000140388204;1649;Paris;geonames:2988507;8;True
Moreau1650_MAZ;Histoire tragique de trois magisiens (sic), qui ont accusé à la mort Mazarin, en Italie, par le sieur H. R . Drazor, Champenois.;Rozard, N.;isni:0000000391335916;Musnier, François;isni:0000000140388204;1649;Paris;geonames:2988507;7;True
Moreau2985_GBOOKS;Recit de ce qui s'est passé a l'emprisonnement du pere de Jules Mazarin;Rozard, N.;isni:0000000391335916;Musnier, François;isni:0000000140388204;1649;Paris;geonames:2988507;8;False
Moreau1732_GBOOKS;Italie (l') vengée de son tyran par les armes des bons François, par le sieur N. R. (Rozard), champenois.;Rozard, N.;isni:0000000391335916;Musnier, François;isni:0000000140388204;1649;Paris;geonames:2988507;8;False
Moreau1675_GBOOKS;Idole (l') renversée, ou le Ministre d'État puni, par D. P. P. sieur de Carigny.;;viaf:309700747;Musnier, François;isni:0000000140388204;1649;Paris;geonames:2988507;8;True
Moreau572_GBOOKS;Balet ridicule des nieces de Mazarin, ou leur theatre renversé en France. Par P.D.P. sieur de Carigny.;Carigny (De), D.P.P.;;Musnier, François;isni:0000000140388204;1649;Paris;geonames:2988507;11;False
Moreau3910_GBOOKS;Union (l') des bons François et le panégyrique qu'ils présentent à nos seigneurs du Parlement.;;;Musnier, François;isni:0000000140388204;1649;Paris;geonames:2988507;8;False
Moreau503_GBOOKS;Avis d’un hermite solitaire à Mazarin, sur les conspirations qu’il a faites contre nos seigneurs de Beaufort et de Vendôme.;;;Musnier, François;isni:0000000140388204;1649;Paris;geonames:2988507;7;False
Moreau2564_GBOOKS;Objet (l') de la haine publique, ou la Honte du ministre d'État découverte.;;;Musnier, François;isni:0000000140388204;1649;Paris;geonames:2988507;8;False
Moreau3554_MAZ;Robe (la) sanglante de Jules Mazarin, ou les Véritables récits des fourbes, des impostures et autres vices, par le sieur de Mirand, gentilhomme cécilien (sic).;;;Musnier, François;isni:0000000140388204;1649;Paris;geonames:2988507;12;True
Moreau1665_GALL;Horoscope (l') de Jules Mazarin, naïvement et fidèlement expliquée (sic) des Centuries de M. Nostrodamus, tant du passé, présent qu'avenir, ensemble des épithètes et thême céleste sur toutes les lettres de son nom et surnom. Le pourtrait de son Père .;;;Musnier, François;isni:0000000140388204;1649;Paris;geonames:2988507;8;True
Moreau4026_MAZ;Vie (la) infâme de la Maltaute (sic), dédiée aux curieux par les peuples de Paris.;;;Musnier, François;isni:0000000140388204;1649;Paris;geonames:2988507;8;True
Moreau2698_MAZ;Paris triomphant et consolé par l'heureux retour de Leurs Majestés en cette ville.;;;Julien, Jean;isni:0000000357084279;1649;Paris;geonames:2988507;7;True
Moreau1368_MAZ;Factum servant au procès criminel fait au cardinal Mazarin, touchant ses intelligences avec les étrangers ennemis de l'État.;;;Guillemot, Veuve de Jean;isni:0000000359773502;1649;Paris;geonames:2988507;8;True
Moreau2218_MAZ;Lettre écrite de Madrid par un gentilhomme es pagnol à un sien ami, par laquelle il lui découvre une partie des intrigues du cardinal Mazarin, traduite de l'espagnol en françois.;;;Guillemot, Veuve de Jean;isni:0000000359773502;1649;Paris;geonames:2988507;7;True
Moreau1766_GBOOKS;Judicieux (le) refus du Parlement de donner au dience aux deux hérauts.;;;Guillemot, Veuve de Jean;isni:0000000359773502;1649;Paris;geonames:2988507;8;False
Moreau1403_GBOOKS;Foudre (la) du bureau et du monopole, en vers scarroniens.;;;Clément, Philippe;isni:0000000360431147;1649;Paris;geonames:2988507;8;False
Moreau3807_GBOOKS;Très-humble et chrétienne remontrance à la reine régente sur les malheurs présents de l'État.;Machon, Louis;isni:000000001027361X;Langlois, Jacques;isni:0000000360940558;1649;Paris;geonames:2988507;14;True
Moreau475_MAZ;Avis à M le cardinal Mazarin, sur le sujet de sa sortie hors le royaume de France.;;;Langlois, Jacques;isni:0000000360940558;1649;Paris;geonames:2988507;8;True
Moreau3797_GBOOKS;Traité de paix de l'âme avec son dieu, dédié à monseigneur le duc de Beaufort, duc et pair de France, propre à ce saint temps.;;;Langlois, Jacques;isni:0000000360940558;1649;Paris;geonames:2988507;8;True
Moreau3suppl62_MAZ;Observations curieuses sur l’État et gouvernement de France, avec les noms, dignitez et familles principales, comme il est en la présente année 1649.;;;Langlois, Jacques;isni:0000000360940558;1649;Paris;geonames:2988507;31;True
Moreau1915_GBOOKS;Lettre de consolation à la reine d'Angleterre.;;;Langlois, Jacques;isni:0000000360940558;1649;Paris;geonames:2988507;12;True
Moreau1788_GALL;Justes (les) reproches de la France à monsieur le prince de Condé.;;;Langlois, Jacques;isni:0000000360940558;1649;Paris;geonames:2988507;8;True
